{
  "$schema": "https://json-schema.org/draft/2020-12/schema",
  "$id": "https://specdev.local/schema/16_delivery_monitoring.schema.json",
  "title": "16_delivery_monitoring",
  "type": "object",
  "additionalProperties": false,
  "properties": {
    "id": {
      "$ref": "https://specdev.local/schema/core/atoms/1#kebabId"
    },
    "owner": {
      "$ref": "https://specdev.local/schema/core/atoms/1#owner"
    },
    "created_at": {
      "$ref": "https://specdev.local/schema/core/atoms/1#timestamp"
    },
    "deployments": {
      "type": "array",
      "items": {
        "type": "object",
        "additionalProperties": false,
        "properties": {
          "env": {
            "type": "string",
            "enum": [
              "dev",
              "staging",
              "prod"
            ]
          },
          "build_id": {
            "$ref": "https://specdev.local/schema/core/atoms/1#kebabId"
          },
          "artifact_uri": {
            "type": "string"
          },
          "status": {
            "type": "string",
            "enum": [
              "pending",
              "success",
              "failed"
            ]
          }
        },
        "required": [
          "env",
          "build_id"
        ]
      }
    },
    "dashboards": {
      "type": "array",
      "items": {
        "type": "object",
        "additionalProperties": false,
        "properties": {
          "dashboard_id": {
            "$ref": "https://specdev.local/schema/core/atoms/1#kebabId"
          },
          "nfr_refs": {
            "$ref": "https://specdev.local/schema/core/collections/1#kebabIdArray"
          },
          "url": {
            "type": "string"
          }
        },
        "required": [
          "dashboard_id"
        ]
      }
    },
    "alerts": {
      "type": "array",
      "items": {
        "type": "object",
        "additionalProperties": false,
        "properties": {
          "alert_id": {
            "$ref": "https://specdev.local/schema/core/atoms/1#kebabId"
          },
          "nfr_ref": {
            "$ref": "https://specdev.local/schema/core/atoms/1#kebabId"
          },
          "rule": {
            "type": "string"
          },
          "severity": {
            "type": "string",
            "enum": [
              "low",
              "medium",
              "high",
              "critical"
            ]
          }
        },
        "required": [
          "alert_id",
          "rule"
        ]
      }
    }
  },
  "required": [
    "id",
    "owner",
    "created_at"
  ]
}